{
  "schema_version": "1.0",
  "brand_id": "future-brand",
  "account_id": 424242,
  "inbox_id": 909090,
  "channel": "whatsapp",
  "channel_capabilities": {
    "supports_text": true,
    "supports_attachments": true,
    "supports_public_reply": true
  },
  "conversation_id": "synthetic-future-conversation",
  "message_id": "synthetic-future-message",
  "delivery_id": null,
  "correlation_id": "future-brand:synthetic:001",
  "idempotency_key": "future-brand:synthetic:event:001",
  "event_at": "2026-08-11T12:00:00+03:00",
  "direction": "inbound",
  "visibility": "public",
  "actor_type": "contact",
  "sender_ref": {
    "kind": "chatwoot_contact",
    "id": "synthetic-future-contact"
  },
  "content": {
    "kind": "text",
    "text_present": true,
    "attachment_count": 0
  },
  "flags": {
    "is_bot_echo": false,
    "is_private_note": false
  }
}
